title,author,year,doi,url,Inclusion/Exclusion criteria
"Proceedings of Third International Conference on Communication, Computing and Electronics Systems",Dr. V. BindhuProf. Jo√£o Manuel R. S. TavaresDr. Ke-Lin Du,2022,10.1007/978-981-16-8862-1,http://link.springer.com/book/10.1007/978-981-16-8862-1,EC5
Proceedings of the 14th International Conference on Soft Computing and Pattern Recognition (SoCPaR 2022),Ajith AbrahamThomas HanneNiketa GandhiPooja Manghirmalani  MishraAnu BajajPatrick Siarry,2023,10.1007/978-3-031-27524-1,http://link.springer.com/book/10.1007/978-3-031-27524-1,EC5
Proceedings of the 4th International Conference on Advances in Computational Science and Engineering,Vinesh ThiruchelvamRayner AlfredZamhar Iswandono Bin Awang IsmailHaviluddin HaviluddinAslina Baharum,2024,10.1007/978-981-97-2977-7,http://link.springer.com/book/10.1007/978-981-97-2977-7,EC5
"Proceedings of the 5th International Conference on Data Science, Machine Learning and Applications; Volume 2",Amit KumarVinit Kumar GunjanSabrina SenatoreYu-Chen Hu,2025,10.1007/978-981-97-8043-3,http://link.springer.com/book/10.1007/978-981-97-8043-3,EC5
Proceedings of the 8th International Conference on Advanced Intelligent Systems and Informatics 2022,Aboul Ella HassanienV√°clav Sn√°≈°elMincong TangTien-Wen SungKuo-Chi Chang,2023,10.1007/978-3-031-20601-6,http://link.springer.com/book/10.1007/978-3-031-20601-6,EC5
"Proceedings of the Future Technologies Conference (FTC) 2022, Volume 2",Kohei Arai,2023,10.1007/978-3-031-18458-1,http://link.springer.com/book/10.1007/978-3-031-18458-1,EC5
"Proceedings of the Future Technologies Conference (FTC) 2023, Volume 1",Kohei Arai,2023,10.1007/978-3-031-47454-5,http://link.springer.com/book/10.1007/978-3-031-47454-5,EC5
"Proceedings of the Future Technologies Conference (FTC) 2023, Volume 2",Kohei Arai,2023,10.1007/978-3-031-47451-4,http://link.springer.com/book/10.1007/978-3-031-47451-4,EC5
"Proceedings of the Future Technologies Conference (FTC) 2024, Volume 1",Kohei Arai,2024,10.1007/978-3-031-73110-5,http://link.springer.com/book/10.1007/978-3-031-73110-5,EC5
"Proceedings of the Future Technologies Conference (FTC) 2024, Volume 2",Kohei Arai,2024,10.1007/978-3-031-73122-8,http://link.springer.com/book/10.1007/978-3-031-73122-8,EC5
Proceedings of the International Conference on Cognitive and Intelligent Computing,Amit KumarGheorghita GhineaSuresh MeruguTakako Hashimoto,2022,10.1007/978-981-19-2350-0,http://link.springer.com/book/10.1007/978-981-19-2350-0,EC5
Proceedings of the International Conference on Intelligent Vision and Computing (ICIVC 2021),Dr. Harish SharmaDr. Vijay Kumar VyasProf. Rajesh Kumar PandeyDr. Mukesh Prasad,2022,10.1007/978-3-030-97196-0,http://link.springer.com/book/10.1007/978-3-030-97196-0,EC5
Proceedings of the International Conference on Ubiquitous Computing & Ambient Intelligence (UCAmI 2022),Jos√© BravoSergio OchoaJes√∫s Favela,2023,10.1007/978-3-031-21333-5,http://link.springer.com/book/10.1007/978-3-031-21333-5,EC5
Proceedings of the International Field Exploration and Development Conference 2023,Jia'en Lin,2024,10.1007/978-981-97-0272-5,http://link.springer.com/book/10.1007/978-981-97-0272-5,EC5
Proceedings of the Seventh International Scientific Conference ‚ÄúIntelligent Information Technologies for Industry‚Äù (IITI‚Äô23),Sergey KovalevIgor KotenkoAndrey Sukhanov,2023,10.1007/978-3-031-43789-2,http://link.springer.com/book/10.1007/978-3-031-43789-2,EC5
Proceedings of the Sixth International Scientific Conference ‚ÄúIntelligent Information Technologies for Industry‚Äù (IITI‚Äô22),Sergey KovalevAndrey SukhanovImran AkperovSebnem Ozdemir,2023,10.1007/978-3-031-19620-1,http://link.springer.com/book/10.1007/978-3-031-19620-1,EC5
Process Implications of Executable Domain Models for Microservices Development,"Wang, Bo and Boehm, Barry W.",2020,10.1145/3379177.3388896,https://doi.org/10.1145/3379177.3388896,EC1
Process-Oriented Approach to the Design of Cyber-Physical Systems,Lech KnapJƒôdrzej MƒÖczakMicha≈Ç Trojgo,2018,10.1007/978-3-319-96598-7_16,http://link.springer.com/chapter/10.1007/978-3-319-96598-7_16,EC1
Process-driven Configuration of Federated Cloud Resources,Denis WeerasiriBoualem BenatallahMoshe Chai Barukh,2015,10.1007/978-3-319-18120-2_20,http://link.springer.com/chapter/10.1007/978-3-319-18120-2_20,EC1
Producing Artificial Intelligent Systems,Maria Isabel Aldinhas Ferreira,2024,10.1007/978-3-031-55817-7,http://link.springer.com/book/10.1007/978-3-031-55817-7,EC1
Product Lifecycle Management Enabling Smart X,Prof. Dr. Felix NyffeneggerJos√© R√≠osLouis RivestProf. Dr. Abdelaziz Bouras,2020,10.1007/978-3-030-62807-9,http://link.springer.com/book/10.1007/978-3-030-62807-9,EC1
Product Lifecycle Management. Green and Blue Technologies to Support Smart and Sustainable Organizations,Prof. Osiris Canciglieri JuniorProf. Fr√©d√©ric No√´lLouis RivestProf. Dr. Abdelaziz Bouras,2022,10.1007/978-3-030-94335-6,http://link.springer.com/book/10.1007/978-3-030-94335-6,EC1
"Product Lifecycle Management. Leveraging Digital Twins, Circular Economy, and Knowledge Management for Sustainable Innovation",Christophe DanjouRamy HarikFelix NyffeneggerLouis RivestAbdelaziz Bouras,2024,10.1007/978-3-031-62582-4,http://link.springer.com/book/10.1007/978-3-031-62582-4,EC1
Product-Focused Software Process Improvement,Pekka AbrahamssonAndreas JedlitschkaAnh Nguyen DucMichael FeldererSousuke AmasakiTommi Mikkonen,2016,10.1007/978-3-319-49094-6,http://link.springer.com/book/10.1007/978-3-319-49094-6,EC1
Product-Focused Software Process Improvement,Davide TaibiMarco KuhrmannTommi MikkonenJil Kl√ºnderPekka Abrahamsson,2022,10.1007/978-3-031-21388-5,http://link.springer.com/book/10.1007/978-3-031-21388-5,EC1
Product-Focused Software Process Improvement,Dr. Maurizio MorisioProf. Marco TorchianoAndreas Jedlitschka,2020,10.1007/978-3-030-64148-1,http://link.springer.com/book/10.1007/978-3-030-64148-1,EC1
Product-Focused Software Process Improvement,Prof. Dr. Xavier FranchTomi M√§nnist√∂Silverio Mart√≠nez-Fern√°ndez,2019,10.1007/978-3-030-35333-9,http://link.springer.com/book/10.1007/978-3-030-35333-9,EC1
Product-Focused Software Process Improvement,Dr. Marco KuhrmannProf. Dr. Kurt SchneiderDietmar PfahlSousuke AmasakiMarcus CiolkowskiProf. Dr. Regina HebigDr. Paolo TellJil Kl√ºnderSteffen K√ºpper,2018,10.1007/978-3-030-03673-7,http://link.springer.com/book/10.1007/978-3-030-03673-7,EC1
Product-Focused Software Process Improvement,Luca ArditoAndreas JedlitschkaDr. Maurizio MorisioProf. Marco Torchiano,2021,10.1007/978-3-030-91452-3,http://link.springer.com/book/10.1007/978-3-030-91452-3,EC1
Production at the Leading Edge of Technology,Thomas BauernhanslAlexander VerlMathias LiewaldHans-Christian M√∂hring,2024,10.1007/978-3-031-47394-4,http://link.springer.com/book/10.1007/978-3-031-47394-4,EC1
Production at the Leading Edge of Technology,Mathias LiewaldAlexander VerlThomas BauernhanslHans-Christian M√∂hring,2023,10.1007/978-3-031-18318-8,http://link.springer.com/book/10.1007/978-3-031-18318-8,EC1
"Programming '24: Companion Proceedings of the 8th International Conference on the Art, Science, and Engineering of Programming",,2024,,,EC5
Promote-pl: a round-trip engineering process model for adopting and evolving product lines,"Kr\""{u}ger, Jacob and Mahmood, Wardah and Berger, Thorsten",2020,10.1145/3382025.3414970,https://doi.org/10.1145/3382025.3414970,EC1
Prototyping a business process improvement plan. An evidence-based approach,Pavlos Delias and Gia-Thi Nguyen,2021,https://doi.org/10.1016/j.is.2021.101812,https://www.sciencedirect.com/science/article/pii/S0306437921000594,EC1
Q-SE 2024: Proceedings of the 5th ACM/IEEE International Workshop on Quantum Software Engineering,,2024,,,EC1
QFaaS: A Serverless Function-as-a-Service framework for Quantum computing,Hoa T. Nguyen and Muhammad Usman and Rajkumar Buyya,2024,https://doi.org/10.1016/j.future.2024.01.018,https://www.sciencedirect.com/science/article/pii/S0167739X24000189,EC1
QP4SE 2022: Proceedings of the 1st International Workshop on Quantum Programming for Software Engineering,,2022,,,EC1
QSOC: Quantum Service-Oriented Computing,Indika KumaraWillem-Jan Van Den HeuvelDamian A. Tamburri,2021,10.1007/978-3-030-87568-8_3,http://link.springer.com/chapter/10.1007/978-3-030-87568-8_3,EC1
QoS-Aware Orchestration of Network Intensive Software Utilities within Software Defined Data Centres,Uro≈° Pa≈°ƒçinskiJernej TrnkoczyVlado StankovskiMatej CigaleSandi Gec,2018,10.1007/s10723-017-9415-1,http://link.springer.com/article/10.1007/s10723-017-9415-1,EC1
Quality assurance strategies for machine learning applications in big data analytics: an overview,Mihajlo OgrizoviƒáDra≈æen Dra≈°koviƒáDragan Bojiƒá,2024,10.1186/s40537-024-01028-y,http://link.springer.com/article/10.1186/s40537-024-01028-y,EC1
Quality of Information and Communications Technology,Antonia BertolinoJo√£o Pascoal FariaPatricia LagoLaura Semini,2024,10.1007/978-3-031-70245-7,http://link.springer.com/book/10.1007/978-3-031-70245-7,EC1
Quality of Information and Communications Technology,Prof. Ana C. R. PaivaAna Rosa CavalliPaula Ventura MartinsRicardo P√©rez-Castillo,2021,10.1007/978-3-030-85347-1,http://link.springer.com/book/10.1007/978-3-030-85347-1,EC1
Quality of Information and Communications Technology,Antonio VallecilloJoost VisserRicardo P√©rez-Castillo,2022,10.1007/978-3-031-14179-9,http://link.springer.com/book/10.1007/978-3-031-14179-9,EC1
Quality of Information and Communications Technology,Jos√© Maria FernandesGuilherme H. TravassosValentina LenarduzziXiaozhou Li,2023,10.1007/978-3-031-43703-8,http://link.springer.com/book/10.1007/978-3-031-43703-8,EC1
Quantitative Evaluation of Systems,Alessandro AbateAssoc. Prof. Andrea Marin,2021,10.1007/978-3-030-85172-9,http://link.springer.com/book/10.1007/978-3-030-85172-9,EC1
Quantum Computing: A New Software Engineering Golden Age,"Piattini, Mario and Peterssen, Guido and P\'{e}rez-Castillo, Ricardo",2020,10.1145/3402127.3402131,https://doi.org/10.1145/3402127.3402131,EC1
Quantum Software,Iaakov ExmanRicardo P√©rez-CastilloMario PiattiniMichael Felderer,2024,10.1007/978-3-031-64136-7,http://link.springer.com/book/10.1007/978-3-031-64136-7,EC1
Quantum Software Development Lifecycle,Benjamin WederJohanna BarzenFrank LeymannDaniel Vietz,2022,10.1007/978-3-031-05324-5_4,http://link.springer.com/chapter/10.1007/978-3-031-05324-5_4,EC1
Quantum Software Engineering,Manuel A. SerranoRicardo P√©rez-CastilloMario Piattini,2022,10.1007/978-3-031-05324-5,http://link.springer.com/book/10.1007/978-3-031-05324-5,EC1
Quantum software engineering and quantum software development lifecycle: a survey,Kanishk DwivediMajid HaghparastTommi Mikkonen,2024,10.1007/s10586-024-04362-1,http://link.springer.com/article/10.1007/s10586-024-04362-1,EC1
Quo Vadis modeling?,Judith MichaelDominik BorkManuel WimmerHeinrich C. Mayr,2024,10.1007/s10270-023-01128-y,http://link.springer.com/article/10.1007/s10270-023-01128-y,EC1
AI-augmented Model-Based Capabilities in the AIDOaRt Project: Continuous Development of Cyber-Physical Systems,"Bagnato, Alessandra and Cicchetti, Antonio and Berardinelli, Luca and Bruneliere, Hugo and Eramo, Romina",2023,10.1145/3591335.3591349,https://doi.org/10.1145/3591335.3591349,IC1
RAPIDO '23: Proceedings of the DroneSE and RAPIDO: System Engineering for constrained embedded systems,,2023,,,EC5
Rapid adjustment and adoption to MIaaS clouds,"Viswanathan, Balaji and Verma, Akshat and Krishnamurthy, Bharat and Jayachandran, Praveen and Bhattacharya, Kamal and Ananthanarayanan, Rema",2012,10.1145/2405146.2405149,https://doi.org/10.1145/2405146.2405149,EC1
"Rapid, evolutionary, reliable, scalable system and software development: the resilient agile process","Rosenberg, Doug and Boehm, Barry and Wang, Bo and Qi, Kan",2017,10.1145/3084100.3084107,https://doi.org/10.1145/3084100.3084107,EC1
Recognizing lines of code violating company-specific coding guidelines using machine learning,Miroslaw OchodekRegina HebigWilhelm MedingGert FrostMiroslaw Staron,2020,10.1007/s10664-019-09769-8,http://link.springer.com/article/10.1007/s10664-019-09769-8,EC1
Reconstruction of an Execution Architecture View by Identifying Mapping Rules for Connectors,Hwi Ahn and Sungwon Kang and Seonah Lee,2024,https://doi.org/10.1016/j.jss.2024.112268,https://www.sciencedirect.com/science/article/pii/S0164121224003121,EC1
Reference Architectures for Automotive Software,Thomas BauerDonald BarkowskiAdam BachorekAndreas Morgenstern,2023,10.1007/978-3-031-16957-1_5,http://link.springer.com/chapter/10.1007/978-3-031-16957-1_5,EC1
Reference Architectures for Critical Domains,Elisa Yumi NakagawaPablo Oliveira Antonino,2023,10.1007/978-3-031-16957-1,http://link.springer.com/book/10.1007/978-3-031-16957-1,EC1
Reference architecture for digital twin-based predictive maintenance systems,Raymon {van Dinter} and Bedir Tekinerdogan and Cagatay Catal,2023,https://doi.org/10.1016/j.cie.2023.109099,https://www.sciencedirect.com/science/article/pii/S0360835223001237,EC1
Reinforcement Learning-Supported AB Testing of¬†Business Process Improvements: An Industry Perspective,Aaron Friedrich KurzTimotheus KampikLuise PufahlIngo Weber,2023,10.1007/978-3-031-34241-7_2,http://link.springer.com/chapter/10.1007/978-3-031-34241-7_2,EC1
Reliability in software engineering qualitative research through Inter-Coder Agreement,√Ångel Gonz√°lez-Prieto and Jorge Perez and Jessica Diaz and Daniel L√≥pez-Fern√°ndez,2023,https://doi.org/10.1016/j.jss.2023.111707,https://www.sciencedirect.com/science/article/pii/S0164121223001024,EC1
Report on the State of the SoSyM Journal end of 2022,St√©phanie ChallitaBenoit CombemaleHuseyin ErginJeff GrayBernhard RumpeMartin Schindler,2023,10.1007/s10270-023-01085-6,http://link.springer.com/article/10.1007/s10270-023-01085-6,EC6
Reprint of ‚ÄúTowards a security-enhanced PaaS platform for multi-cloud applications‚Äù,Kyriakos Kritikos and Tom Kirkham and Bartosz Kryza and Philippe Massonet,2018,https://doi.org/10.1016/j.future.2016.11.014,https://www.sciencedirect.com/science/article/pii/S0167739X16306343,EC7
Requirements Engineering: Foundation for Software Quality,Daniel MendezAna Moreira,2024,10.1007/978-3-031-57327-9,http://link.springer.com/book/10.1007/978-3-031-57327-9,EC1
Requirements Engineering: Foundation for Software Quality,Vincenzo GervasiAndreas Vogelsang,2022,10.1007/978-3-030-98464-9,http://link.springer.com/book/10.1007/978-3-030-98464-9,EC1
Requirements Engineering: Foundation for Software Quality,Alessio FerrariBirgit Penzenstadler,2023,10.1007/978-3-031-29786-1,http://link.springer.com/book/10.1007/978-3-031-29786-1,EC1
Requirements in the software lifecycle,Bertrand Meyer,2022,10.1007/978-3-031-06739-6_12,http://link.springer.com/chapter/10.1007/978-3-031-06739-6_12,EC1
Research Challenges in Information Science,Renata GuizzardiDr. Jolita Ralyt√©Prof. Dr. Xavier Franch,2022,10.1007/978-3-031-05760-1,http://link.springer.com/book/10.1007/978-3-031-05760-1,EC5
Research Challenges in Information Science: Information Science and the Connected World,Selmin NurcanAndreas L. OpdahlHaralambos MouratidisAggeliki Tsohou,2023,10.1007/978-3-031-33080-3,http://link.springer.com/book/10.1007/978-3-031-33080-3,EC5
Research and Innovation Forum 2021,Prof. Anna VisviziOrlando TroisiDr. Kawther Saeedi,2021,10.1007/978-3-030-84311-3,http://link.springer.com/book/10.1007/978-3-030-84311-3,EC5
Research and Innovation Forum 2022,Anna VisviziOrlando TroisiMara Grimaldi,2023,10.1007/978-3-031-19560-0,http://link.springer.com/book/10.1007/978-3-031-19560-0,EC5
Research and Innovation Forum 2023,Anna VisviziOrlando TroisiVincenzo Corvello,2024,10.1007/978-3-031-44721-1,http://link.springer.com/book/10.1007/978-3-031-44721-1,EC5
Reuse and Software Quality,Achilleas AchilleosLidia FuentesGeorge Angelos Papadopoulos,2024,10.1007/978-3-031-66459-5,http://link.springer.com/book/10.1007/978-3-031-66459-5,EC1
Risk-driven framework for decision support in cloud service selection,"Gupta, Smrati and Muntes-Mulero, Victor and Matthews, Peter and Dominiak, Jacek and Omerovic, Aida and Aranda, Jordi and Seycek, Stepan",2015,10.1109/CCGrid.2015.111,https://doi.org/10.1109/CCGrid.2015.111,EC1
Risks and Security of Internet and Systems,Bo LuoMohamed MosbahFr√©d√©ric CuppensLotfi Ben OthmaneNora CuppensSlim Kallel,2022,10.1007/978-3-031-02067-4,http://link.springer.com/book/10.1007/978-3-031-02067-4,EC1
Robot Operating System (ROS),Dr. Anis Koubaa,2021,10.1007/978-3-030-75472-3,http://link.springer.com/book/10.1007/978-3-030-75472-3,EC1
Role of Machine Learning in ETL Automation,"Mondal, Kartick Chandra and Biswas, Neepa and Saha, Swati",2020,10.1145/3369740.3372778,https://doi.org/10.1145/3369740.3372778,EC1
Run-time evaluation of architectures: A case study of diversification in IoT,Dalia Sobhy and Leandro Minku and Rami Bahsoon and Tao Chen and Rick Kazman,2020,https://doi.org/10.1016/j.jss.2019.110428,https://www.sciencedirect.com/science/article/pii/S016412121930202X,EC1
SAC '23: Proceedings of the 38th ACM/SIGAPP Symposium on Applied Computing,,2023,,,EC5
SAC '24: Proceedings of the 39th ACM/SIGAPP Symposium on Applied Computing,,2024,,,EC5
SATrends '24: Proceedings of the 1st International Workshop on New Trends in Software Architecture,,2024,,,EC5
SBES '22: Proceedings of the XXXVI Brazilian Symposium on Software Engineering,,2022,,,EC5
SBES '23: Proceedings of the XXXVII Brazilian Symposium on Software Engineering,,2023,,,EC5
SBQS '22: Proceedings of the XXI Brazilian Symposium on Software Quality,,2022,,,EC5
SBQS '23: Proceedings of the XXII Brazilian Symposium on Software Quality,,2023,,,EC5
SBSI '24: Proceedings of the 20th Brazilian Symposium on Information Systems,,2024,,,EC5
"SC '22: Proceedings of the International Conference on High Performance Computing, Networking, Storage and Analysis",,2022,,,EC5
"SC '23: Proceedings of the International Conference for High Performance Computing, Networking, Storage and Analysis",,2023,,,EC5
"SC-W '23: Proceedings of the SC '23 Workshops of The International Conference on High Performance Computing, Network, Storage, and Analysis",,2023,,,EC5
SDN/NFV architectures for edge-cloud oriented IoT: A systematic review,Partha Pratim Ray and Neeraj Kumar,2021,https://doi.org/10.1016/j.comcom.2021.01.018,https://www.sciencedirect.com/science/article/pii/S0140366421000396,EC1
SERP4IoT '24: Proceedings of the ACM/IEEE 6th International Workshop on Software Engineering Research &amp; Practices for the Internet of Things,,2024,,,EC5
SERP4IoT'21 Workshop Report,"Gu\'{e}h\'{e}neuc, Yann-Ga\""{e}l and Humayoun, Shah Rukh and Morales, Rodrigo and Saborido, Rub\'{e}n",2021,10.1145/3485952.3485959,https://doi.org/10.1145/3485952.3485959,EC5
SESoS '22: Proceedings of the 10th IEEE/ACM International Workshop on Software Engineering for Systems-of-Systems and Software Ecosystems,,2022,,,EC5
SLE '24: Proceedings of the 17th ACM SIGPLAN International Conference on Software Language Engineering,,2024,,,EC5
SLE 2016: Proceedings of the 2016 ACM SIGPLAN International Conference on Software Language Engineering,,2016,,,EC5
SMADA-Fog: Semantic model driven approach to deployment and adaptivity in fog computing,Nenad Petrovic and Milorad Tosic,2020,https://doi.org/10.1016/j.simpat.2019.102033,https://www.sciencedirect.com/science/article/pii/S1569190X19301649,EC1
SMT-Based Planning Synthesis for Distributed System Reconfigurations,Simon RobillardH√©l√®ne Coullon,2022,10.1007/978-3-030-99429-7_15,http://link.springer.com/chapter/10.1007/978-3-030-99429-7_15,EC1
SODALITE@RT: Orchestrating Applications on Cloud-Edge Infrastructures,Indika KumaraPaul MundtKamil TokmakovDragan RadoloviƒáAlexander MaslennikovRom√°n Sosa Gonz√°lezJorge Fern√°ndez FabeiroGiovanni QuattrocchiKalman MethElisabetta Di NittoDamian A. TamburriWillem-Jan Van Den HeuvelGeorgios Meditskos,2021,10.1007/s10723-021-09572-0,http://link.springer.com/article/10.1007/s10723-021-09572-0,EC1
SOSP '23: Proceedings of the 29th Symposium on Operating Systems Principles,,2023,,,EC5
DevCertOps: Strategies to Realize Continuous Delivery of Safe Software in Regulated Domain,"Zeller, Marc",2023,10.1109/ICSE-Companion58688.2023.00094,https://doi.org/10.1109/ICSE-Companion58688.2023.00094,IC1
Safe Software and Secure Software,Frank J. Furrer,2022,10.1007/978-3-658-37182-1_5,http://link.springer.com/chapter/10.1007/978-3-658-37182-1_5,EC1
Safety and Security of Cyber-Physical Systems,Dr. Frank J. Furrer,2022,10.1007/978-3-658-37182-1,http://link.springer.com/book/10.1007/978-3-658-37182-1,EC1
Scaling Customer Success,Chitra MadhwacharyulaShreesha Ramdas,2023,10.1007/978-1-4842-9192-4,http://link.springer.com/book/10.1007/978-1-4842-9192-4,EC1
Scenarios in the loop: integrated requirements analysis and automotive system validation,"Wiecher, Carsten and Japs, Sergej and Kaiser, Lydia and Greenyer, Joel and Dumitrescu, Roman and Wolff, Carsten",2020,10.1145/3417990.3421264,https://doi.org/10.1145/3417990.3421264,EC1
Search-Based Software Engineering,Prof. Una-May O'ReillyPh.D. Xavier Devroey,2021,10.1007/978-3-030-88106-1,http://link.springer.com/book/10.1007/978-3-030-88106-1,EC5
Search-Based Software Engineering,Paolo ArcainiTao YueErik M. Fredericks,2024,10.1007/978-3-031-48796-5,http://link.springer.com/book/10.1007/978-3-031-48796-5,EC5
Secure software development and testing: A model-based methodology,Valentina Casola and Alessandra {De Benedictis} and Carlo Mazzocca and Vittorio Orbinato,2024,https://doi.org/10.1016/j.cose.2023.103639,https://www.sciencedirect.com/science/article/pii/S0167404823005497,EC1
Secure software development in the era of fluid multi-party open software and services,"Pashchenko, Ivan and Scandariato, Riccardo and Sabetta, Antonino and Massacci, Fabio",2021,10.1109/ICSE-NIER52604.2021.00027,https://doi.org/10.1109/ICSE-NIER52604.2021.00027,EC1
Security Compliance in Model-Driven Software Development,Sven Peldszus,2024,10.1007/978-3-031-44412-8_4,http://link.springer.com/chapter/10.1007/978-3-031-44412-8_4,EC1
Security Compliance in Model-driven Development of Software Systems in Presence of Long-Term Evolution and Variants,Sven Matthias Peldszus,2022,10.1007/978-3-658-37665-9,http://link.springer.com/book/10.1007/978-3-658-37665-9,EC1
Security Enforcement for Multi-Cloud Platforms ‚Äì The Case of PaaSage,Kyriakos Kritikos and Tom Kirkham and Bartosz Kryza and Philippe Massonet,2015,https://doi.org/10.1016/j.procs.2015.09.227,https://www.sciencedirect.com/science/article/pii/S1877050915030720,EC1
Security Requirements Formalization with RQCODE,Andrey SadovykhNan MesseIldar NigmatullinSophie EbersoldMaria NaumchevaJean-Michel Bruel,2024,10.1007/978-3-031-42212-6_3,http://link.springer.com/chapter/10.1007/978-3-031-42212-6_3,EC1
Security controls in infrastructure as code,Sadiq Almuairfi and Mamdouh Alenezi,2020,https://doi.org/10.1016/S1361-3723(20)30109-3,https://www.sciencedirect.com/science/article/pii/S1361372320301093,EC1
Security-Based Adaptation of Multi-cloud Applications,Kyriakos KritikosPhilippe Massonet,2016,10.1007/978-3-319-29883-2_4,http://link.springer.com/chapter/10.1007/978-3-319-29883-2_4,EC1
Selected Perspectives on Platforms in E-Commerce Ecosystems,Tobias Wulfert,2024,10.1007/978-3-658-45198-1,http://link.springer.com/book/10.1007/978-3-658-45198-1,EC1
Self-awareness of Cloud Applications,Alex IosupXiaoyun ZhuArif MerchantEva KalyvianakiMartina MaggioSimon SpinnerTarek AbdelzaherOle MengshoelSara Bouchenak,2017,10.1007/978-3-319-47474-8_20,http://link.springer.com/chapter/10.1007/978-3-319-47474-8_20,EC1
Self-healing Multi-Cloud Application Modelling,"Rios, Erkuden and Iturbe, Eider and Palacios, Maria Carmen",2017,10.1145/3098954.3104059,https://doi.org/10.1145/3098954.3104059,EC1
Serverless Software Engineering ‚Äì and How to Get There.,Stephen McAleeseJordan Conway McLaughlinFilip DetynaAndrey MurashevMurat YilmazPaul M. Clarke,2022,10.1007/978-3-031-15559-8_6,http://link.springer.com/chapter/10.1007/978-3-031-15559-8_6,EC1
Service Design for Emerging Technologies Product Development,Umar Zakir Abdul HamidMari Suoheimo,2023,10.1007/978-3-031-29306-1,http://link.springer.com/book/10.1007/978-3-031-29306-1,EC1
"Service Oriented, Holonic and Multi-Agent Manufacturing Systems for Industry of the Future",Theodor BorangiuDamien TrentesauxPaulo Leit√£oLamia BerrahJose-Fernando Jimenez,2024,10.1007/978-3-031-53445-4,http://link.springer.com/book/10.1007/978-3-031-53445-4,EC1
"Service Oriented, Holonic and Multi-Agent Manufacturing Systems for Industry of the Future",Theodor BorangiuDamien TrentesauxPaulo Leit√£o,2023,10.1007/978-3-031-24291-5,http://link.springer.com/book/10.1007/978-3-031-24291-5,EC1
Service-Oriented Computing,Johanna Barzen,2021,10.1007/978-3-030-87568-8,http://link.springer.com/book/10.1007/978-3-030-87568-8,EC5
Service-Oriented Computing,Javier TroyaBrahim MedjahedMario PiattiniLina YaoPablo Fern√°ndezAntonio Ruiz-Cort√©s,2022,10.1007/978-3-031-20984-0,http://link.springer.com/book/10.1007/978-3-031-20984-0,EC5
Service-Oriented Computing,Hakim HacidOdej KaoMassimo MecellaDr. Naouel MohaHye-young Paik,2021,10.1007/978-3-030-91431-8,http://link.springer.com/book/10.1007/978-3-030-91431-8,EC5
Service-Oriented Computing,Flavia MontiStefanie Rinderle-MaAntonio Ruiz Cort√©sZibin ZhengMassimo Mecella,2023,10.1007/978-3-031-48421-6,http://link.springer.com/book/10.1007/978-3-031-48421-6,EC5
Service-Oriented Computing,Flavia MontiStefanie Rinderle-MaAntonio Ruiz Cort√©sZibin ZhengMassimo Mecella,2023,10.1007/978-3-031-48424-7,http://link.springer.com/book/10.1007/978-3-031-48424-7,EC5
